{
  "$schema": "https://json-schema.org/draft/2020-12/schema",
  "$id": "contract-validity.schema.json",
  "type": "object",
  "additionalProperties": false,
  "required": [
    "schemaVersion",
    "artifactType",
    "targetId",
    "contractHash",
    "decision",
    "reviewerId",
    "reviewedAt",
    "reviewedContractFields"
  ],
  "properties": {
    "schemaVersion": { "const": "0.1.0" },
    "artifactType": { "const": "contract-validity" },
    "targetId": { "type": "string", "minLength": 1 },
    "contractHash": { "type": "string", "pattern": "^sha256:[a-f0-9]{64}$" },
    "decision": { "const": "approved" },
    "reviewerId": { "type": "string", "minLength": 1 },
    "reviewedAt": {
      "type": "string",
      "pattern": "^\\d{4}-\\d{2}-\\d{2}T\\d{2}:\\d{2}:\\d{2}(?:\\.\\d{3})?Z$"
    },
    "reviewedContractFields": {
      "type": "array",
      "items": { "type": "string" },
      "minItems": 10,
      "uniqueItems": true
    }
  }
}
