{
  "schemaVersion": "0.1.0",
  "artifactType": "contract-validity",
  "targetId": "dummy-cli-agent",
  "contractHash": "sha256:a392041231f42395a12209dd52d50bbdb645d7798ac3c7556d3501bb64cf9212",
  "decision": "approved",
  "reviewerId": "generic-fixture-maintainer",
  "reviewedAt": "2026-07-25T00:00:00.000Z",
  "reviewedContractFields": [
    "entrypoints",
    "roles",
    "statuses",
    "statusSemantics",
    "requiredOwners",
    "routing",
    "joins",
    "artifacts",
    "states",
    "budgets",
    "commandPolicy"
  ]
}
