{
  "schemaVersion": "0.1.0",
  "artifactType": "contract-validity",
  "targetId": "minimal-directory-agent",
  "contractHash": "sha256:62e35803ad788b1c779f043334657c727f9992ba61bc84b297f7f1c104979bde",
  "decision": "approved",
  "reviewerId": "generic-fixture-maintainer",
  "reviewedAt": "2026-07-25T00:00:00.000Z",
  "reviewedContractFields": [
    "entrypoints",
    "roles",
    "statuses",
    "statusSemantics",
    "requiredOwners",
    "routing",
    "joins",
    "artifacts",
    "states",
    "budgets",
    "commandPolicy"
  ]
}
